{
  "$schema": "https://json-schema.org/draft/2020-12/schema",
  "$id": "https://getmaipai.github.io/shared/spec/schemas/reply-plan.schema.json",
  "title": "ReplyPlan",
  "description": "SPEC-01 (dev.md section 12 part 3, amended by section 13 part 9 and the coherence review, question 1). A plan of permitted moves, not an order: the engine turns the signal, the protocol state, the surface, an explicit brevity request, the age band and the available evidence into this, and the composer realizes it in the companion's voice. Replaces the composer's earlier fixed 'react, pick, say, point' order (dev.md section 6 part 1, amended). A value shape, carried on conversation-turn.schema.json's own `plan` field, never synced independently. The move vocabulary is declared once, exactly here: react, care, say, pick, point, ask_back, close, defer, plus one optional ninth, `capture` (CAPTURE-REQ-01, owner ruling 2026-10-16: a plan may ask the robot for one camera picture during a turn; absent means forbidden, so every existing plan is unchanged). No item may add a tenth.\n\nWhat this deliberately does not carry (ACT-03 narrowed, the coherence review's over-design finding): no `claim_state` (section 14, deferred to CRED-01), no `credulity` block (section 15, deferred), no typed move fields on a streamed chat turn (those exist only on a composed/lookup turn's ComposedTurn, off the interactive path per the review's cost analysis - a streamed reply is checked against this plan at the guard boundary instead, by deterministic signs in the sentences).",
  "type": "object",
  "additionalProperties": false,
  "required": [
    "moves", "playfulness", "max_sentences", "max_words",
    "age_band", "vocabulary_level", "explanation_style", "trusted_adult_move", "content_disclosure"
  ],
  "$defs": {
    "move_state": {
      "type": "string",
      "enum": ["required", "allowed", "forbidden"]
    }
  },
  "properties": {
    "moves": {
      "type": "object",
      "additionalProperties": false,
      "required": ["react", "care", "say", "pick", "point", "ask_back", "close", "defer"],
      "properties": {
        "react": { "$ref": "#/$defs/move_state", "description": "A short reaction to the emotion or the news." },
        "care": { "$ref": "#/$defs/move_state", "description": "An acknowledgment of a marked emotion, ahead of any other content." },
        "say": { "$ref": "#/$defs/move_state", "description": "The substantive answer or acknowledgment." },
        "pick": { "$ref": "#/$defs/move_state", "description": "Choosing one of several candidates the evidence offers." },
        "point": { "$ref": "#/$defs/move_state", "description": "Citing a source, a link, or a document - forbidden on the child band (section 13 part 1)." },
        "ask_back": { "$ref": "#/$defs/move_state", "description": "A follow-up question." },
        "close": { "$ref": "#/$defs/move_state", "description": "A reciprocal closing." },
        "defer": { "$ref": "#/$defs/move_state", "description": "AGE-01 (section 13 part 3): naming a trusted adult as the place for what the hub will not decide or recite, rather than pointing to a source. The trusted-adult move, distinct from `point`." },
        "capture": { "$ref": "#/$defs/move_state", "description": "CAPTURE-REQ-01 (owner ruling 2026-10-16, allowed for every age band): ask the paired robot for one camera picture during this turn (\"what is this?\"). Optional; a plan that omits it forbids it. The frame lives only for the turn, is never stored, and the robot shows its Eyes cue while it is taken; the hub keeps a parent-visible record that a capture happened (no image)." }
      }
    },
    "playfulness": {
      "type": "string",
      "enum": ["allowed", "forbidden"],
      "description": "Forbidden under every negative-emotion override and on the child band whenever a negative emotion or a harm/illness/death/living-thing question is in play (section 13 part 1)."
    },
    "max_sentences": { "type": "integer", "minimum": 1 },
    "max_words": { "type": "integer", "minimum": 1 },
    "age_band": {
      "type": "string",
      "enum": ["child", "teen", "adult"],
      "description": "Copied from the frozen TurnSignal.age_band, so the plan is self-contained for the composer and the guards without a second read of the signal."
    },
    "vocabulary_level": {
      "type": "string",
      "enum": ["simple", "standard", "advanced"],
      "description": "Section 13 part 1's own `complexity` dial, renamed and moved here (the coherence review, question 1: 'vocabulary_level replaces a forced complexity dial, one field'). `simple` forced on the child band; capped at `standard` on the teen band; the companion's own dial on adult, never above what the band allows."
    },
    "explanation_style": {
      "type": "string",
      "enum": ["concrete", "plain", "full"],
      "description": "Section 13 part 1: `concrete` on the child band (concrete words, no abstractions, no idioms a child cannot parse); `plain` on the teen band (no talking down); `full` on the adult band (the companion's own register). AGE-01/ACT-03's own field to build against; this shape is a starting point, not yet read by any engine code."
    },
    "trusted_adult_move": {
      "type": "string",
      "enum": ["none", "name_adult", "offer_to_ask"],
      "description": "Section 13 part 3: how the `defer` move, when present, should read. `name_adult`: name a trusted adult as the place for the answer. `offer_to_ask`: also offer to relay the child's question to them (queues an OpenQuestion of kind `relay`). `none` when `defer` is not `required` or `allowed` this turn. AGE-01/ACT-03's own field to build against; this shape is a starting point, not yet read by any engine code."
    },
    "content_disclosure": {
      "type": "string",
      "enum": ["full", "some_withheld"],
      "description": "Section 13 part 2: whether every piece of evidence handed to the composer this turn was shown in full, or at least one item was summarized or withheld by the content ceiling or a household record's child_disclosure - so the reply can say so honestly ('some of what came back is for grown-ups') rather than pretending nothing was found. The per-item detail lives on the bench's own evidenceDisposition expectation, not here; this is the one summary bit the plan carries. AGE-01/ACT-03's own field to build against; this shape is a starting point, not yet read by any engine code."
    },
    "react_move": {
      "type": ["string", "null"],
      "minLength": 1,
      "default": null,
      "description": "Optional Pollen clip name for the react slot. It must appear in the optional PKG-MOVES-01 manifest; the primitive remains available when that pack is absent. Deterministic age, safety, consent, crisis, alarm, held and muted gates may suppress it."
    }
  }
}
